title,score,url,time
How to gain code execution on hundreds of millions of people and popular apps,589,https://kibty.town/blog/todesktop/,2025-02-28 21:05:35
Self-Hosting a Firefox Sync Server,134,https://blog.diego.dev/posts/firefox-sync-server/,2025-03-01 01:03:48
400 reasons to not use Microsoft Azure,328,https://azsh.it,2025-02-28 20:51:34
Zen 5's AVX-512 Frequency Behavior,39,https://chipsandcheese.com/p/zen-5s-avx-512-frequency-behavior,2025-03-01 04:10:46
"3,200% CPU Utilization",373,https://josephmate.github.io/2025-02-26-3200p-cpu-util/,2025-02-28 17:01:43
OlmOCR: Open-source tool to extract plain text from PDFs,153,https://olmocr.allenai.org/,2025-02-25 16:51:47
Affixes: The Building Blocks of English,37,https://www.affixes.org/index.html,2025-02-26 18:43:20
"When eBPF pt_regs reads return garbage on the latest Linux kernels, blame Fred",62,https://tanelpoder.com/posts/ebpf-pt-regs-error-on-linux-blame-fred/,2025-03-01 01:37:26
Why it's so hard to build a jet engine,138,https://www.construction-physics.com/p/why-its-so-hard-to-build-a-jet-engine,2025-02-28 23:05:21
"The Dino, the Llama, and the Whale (Deno and Jupyter for Local AI Experiments)",31,https://deno.com/blog/the-dino-llama-and-whale,2025-02-28 11:43:22
Troubleshooting: A skill that never goes obsolete,194,https://www.autodidacts.io/troubleshooting/,2025-02-25 12:03:04
Merlion: A Machine Learning Framework for Time Series Intelligence,126,https://github.com/salesforce/Merlion,2025-02-28 18:59:23
Show HN: Torii – a framework agnostic authentication library for Rust,38,https://github.com/cmackenzie1/torii-rs,2025-02-28 23:16:16
Harnessing orbital Hall effect in spin-orbit torque MRAM,5,https://www.nature.com/articles/s41467-024-55437-x,2025-02-25 12:33:32
An update on Mozilla's terms of use for Firefox,279,https://blog.mozilla.org/en/products/firefox/update-on-terms-of-use/,2025-02-28 23:59:35
Write to Escape Your Default Setting,283,https://kupajo.com/write-to-escape-your-default-setting/,2025-02-28 14:45:36
Japanese Toshiba Typewriter Model BW-2112 (2020) [video],64,https://www.youtube.com/watch?v=JZcui85b4EE,2025-02-28 20:51:34
Boris Spassky: 1937–2025,269,https://en.chessbase.com/post/boris-spassky-1937-2025,2025-02-28 08:02:33
"AI is killing some companies, yet others are thriving – let's look at the data",156,https://www.elenaverna.com/p/ai-is-killing-some-companies-yet,2025-02-28 15:12:54
Surgery implants tooth material in eye as scaffolding for lens,113,https://www.cbc.ca/radio/asithappens/tooth-in-eye-surgery-canada-1.7470626,2025-02-28 04:26:52
A Path to Scalable Quantum Computers,7,https://physics.aps.org/articles/v18/40,2025-02-25 12:34:25
"Violence alters human genes for generations, researchers discover",379,https://news.ufl.edu/2025/02/syrian-violence-epigenetics/,2025-02-28 15:33:39
The Housing Theory of Everything (2021),132,https://worksinprogress.co/issue/the-housing-theory-of-everything/,2025-03-01 00:59:13
Calendar.txt,287,https://terokarvinen.com/2021/calendar-txt/,2025-02-24 14:51:53
Zelensky leaves White House after angry meeting,2295,https://www.bbc.com/news/live/c625ex282zzt,2025-02-28 18:49:46
Failure Theory for Materials Science and Engineering – Richard M. Christensen,28,https://www.failurecriteria.com/,2025-02-25 09:04:22
Stone Soup AI (2024),103,https://simons.berkeley.edu/news/stone-soup-ai,2025-02-25 07:02:58
Hot take: GPT 4.5 is a nothing burger,171,https://garymarcus.substack.com/p/hot-take-gpt-45-is-a-nothing-burger,2025-02-28 09:24:13
Show HN: Globstar – Open-source static analysis toolkit,85,N/A,2025-02-28 17:12:26
Netboot Windows 11 with iSCSI and iPXE,175,https://terinstock.com/post/2025/02/Netboot-Windows-11-with-iSCSI-and-iPXE/,2025-02-28 11:47:52
Microsoft is killing Skype,647,https://www.windowscentral.com/microsoft/microsoft-is-reportedly-killing-skype-after-14-years-of-neglect,2025-02-28 05:31:49
WebShield – A new wide-spectrum content blocker for Safari,128,https://github.com/arjpar/WebShield,2025-02-28 11:21:04
"Deconstructing the ""Whimsical Animations"" landing page",117,https://www.joshwcomeau.com/blog/whimsical-animations/,2025-02-25 12:35:56
"Gleam, Coming from Erlang",195,https://olano.dev/blog/gleam-coming-from-erlang/,2025-02-25 07:54:00
Show HN: Betting game puzzle (Hamming neighbor sum in linear time),46,N/A,2025-02-28 20:33:43
Fire-Flyer File System from DeepSeek,336,https://github.com/deepseek-ai/3FS,2025-02-28 01:26:26
Why and How I use “Org Mode” for my writing and more (2022),189,https://www.evalapply.org/posts/why-and-how-i-use-org-mode/index.html,2025-02-24 09:53:00
GPT-4.5,1104,https://openai.com/index/introducing-gpt-4-5/,2025-02-27 20:01:16
Show HN: a Rust library for creating hierarchical state machines,12,https://docs.rs/moku/0.2.0/moku/,2025-02-28 23:30:37
Vibe Coding and the Future of Software Engineering,90,https://alexp.pl/2025/02/19/vibe-coding.html,2025-02-25 09:06:21
Microsoft begins turning off uBlock Origin and other extensions in Edge,724,https://www.neowin.net/news/microsoft-begins-turning-off-ublock-origin-and-other-extensions-in-edge/,2025-02-28 05:20:13
The serotonin theory of depression: a systematic review of the evidence (2022),102,https://www.nature.com/articles/s41380-022-01661-0,2025-02-27 18:27:01
Resident physicians' exam scores tied to patient survival,60,https://hms.harvard.edu/news/resident-physicians-exam-scores-tied-patient-survival,2025-02-25 16:18:11
Launch HN: Bild AI (YC W25) – Understand Construction Blueprints Using AI,94,N/A,2025-02-27 17:30:51
Openlayer (YC S21) is hiring a senior back end engineer,1,https://www.ycombinator.com/companies/openlayer/jobs/yIE9WI3-senior-backend-engineer,2025-02-28 12:00:16
Electric Propulsion Magnets Ready for Space Tests,96,https://spectrum.ieee.org/electric-propulsion-thruster,2025-02-24 14:06:16
Ask HN: Recommend resources that helped your game dev journey?,157,N/A,2025-02-25 09:07:41
"Hydrogen becomes a superfluid at nanoscale, confirming 50-year-old prediction",35,https://phys.org/news/2025-02-hydrogen-superfluid-nanoscale-year.html,2025-02-28 14:19:05
Introducing a terms of use and updated privacy notice for Firefox,239,https://blog.mozilla.org/en/products/firefox/firefox-news/firefox-terms-of-use/,2025-02-26 17:31:58
Open Source LLMOps Stack,52,https://oss-llmops-stack.com,2025-02-26 09:41:38
